OH SHIT Nike MARTY McFLYs RT @user Shoelace makers are taking a loss on these sneakers... http://www.url.com 	negative
Consumer confidence now lower than when Swan/Labor/Rudd went overboard talking DOWN Aus economy re GFC. Nice one ALP #competenceFAIL #auspol	negative
Phone 4ever bout to die #Imout	negative
Why does Gucci have an ice cream cone tatted on his face......smh	negative
It's kill or be killed	negative
God damn it! Tom k's Audi out of #lemans after not even an hour :(	negative
Worst Twitter campaign ever? Microsoft uses Japanese disaster to boost Bing. - http://www.url.com  #computerworld #socialmediamarketing	negative
Feeling poorly; have flu; not nice	negative
The sun is so hottt	negative
Netflix's vanished Sony films are an ominous sign  http://www.url.com  via @user	negative
Don't have study sessions with @user and @user ... you'll regret it!! ;)	negative
Graft buster finds problems in cemetery probe http://www.url.com	negative
weigh in is just a few hrs away ***scared***	negative
You stupid motherSucka's !	negative
On a bike ride with @user almost died twice :L	negative
Lol RT @user Lloyd Cele looks like Monique and Gucci Mane's bastard son.	negative
Ugh all this subtweeting girl nobody is watching yo tweets stop showin off tweets yu rapper stalker Run nelly bow wow ti gucci ahhhhhh nasty	negative
If this was okay I wouldn't have a heart	negative
damn they blocked off hilton pkwy. Fml lol	negative
Sony hacked again | Reuters http://www.url.com  -I wonder if Sony has gotten the point yet not to mess with the hacking community?	negative
Wtf are u kidding me!!! The saints are marching in welp!!	negative
*immediately changes station as gucci gucci comes on*	negative
As @user has pointed out; the All Blacks have not won the RWC while Adidas has been the sponsor. Adidas *is* the problem.	negative
Yesssir!  Shits looking black and ugly as ever; however shits gucci down to the socks!RT @user yo u fixed the range @user ??	negative
This headache is killing me softly ..	negative
"@Keezy_TaughtU: What I learn is NIGGAS will be NIGGAS u just got to live with it..." yep	negative
I'm as bored as Gucci Mane's lips are dry. Hella.	negative
Watching scary movies with Hanna Val and allie #nervous	negative
How bout I take ur number #really means I'm not interested and ull never hear from me	negative
"@TheRealTrain: @user you don't know music" but your ipod is filled with Gucci O_o	negative
And now I have to walk home. Ugh	negative
Good start to mothers day. Husband snored till 2am then woke me up at 7.45 texting co's he doesn't know how to put key strokes on silent	negative
Cargo shorts and high nike socks are over worn.	negative
Downloaded the Nike app to log my running; she wouldn't shut the fuck up though. So I disabled her thinking - Showed you! Alas; still there!	negative
Its cold af in my room " gahh lee " burrrr ( gucci voice )	negative
Why the crap am I up so early?!	negative
Jen is fucked up lol	negative
Yo is jus me or r tha mosquito's big as shit this year!!!	negative
wisdom tooth equals ouch + chipmunk face x 10;0000	negative
Skype goes down globally again; Microsoft starts wondering if it bought wisely http://www.url.com  Could it be related to solar activity?	negative
i'm off to bed; lots of packing to do tomorrow; must find the wellies; it ALWAYS rains at the caravan :-(	negative
Apple Developers beware of malicious email claiming you got a free iTunes Giftcard: http://www.url.com  - Just got one myself.	negative
34 down. Shoot for grafting: p-a-l-i-n (apparently they confused grafting w/ grifting) #foundcrossword	negative
I can finally say we're through.	negative
Also check out the lawsuits against Microsoft for bricking consoles.  They tread alott lighter than you think. Terms or no terms.	negative
Haha; lame Microsoft. RT @user Microsoft site attempts to discourage PC users from switching to Mac http://www.url.com 	negative
I'm so freakin hungry!!!!	negative
damn havent tweeted ina long time. Been busy; shit and bout to go to VERMONT for a week. #18hourCARRIDE.	negative
awkward moment when your mum finds condoms in your bag but doesn't question you about them.	negative
I'm in one of those shitty; jealous moods but also positive and creative; but still shitty. I need a hug? Shit; I need one everyday.	negative
#inappropriatefuneralsongs Kurupt - Its Over	negative
Twitter ruins you. Literally. You lose everything you own. Yes; your toothbrush; POOF; gone.	negative
if punk is soo big and bad why didnt he get in the ring with nexus	negative
its a fucking train ride; stop acting little children; or get your fucking mommy to drive you	negative
#uknowubrokewhen you draw a nike sign on ya sneakers!!!!!!!!!!!!!!!!!	negative
Don't ask me 4 sexy pics dude. Gucci mane has ur mind twisted	negative
Another artist on the losing end of his creativity: http://www.url.com  Sony steals; gets away w/it? #NoJustice #JoeQuirk	negative
#asylumcellnumber I can haz one? I've recently sunburned my Leech tattoo and my pale skin is ruined. Would really make my day @user	negative
Movie was uneven too. Loved Julia; not so much Julie. RT @user I have officially lost interest in Julie & Julia. Now skimming ...	negative
Photoset: Nike Air Force 1 Duckboot – Black/Khaki Why did they make something so ugly… http://www.url.com 	negative
Boarded without my tooth paste; damn you TSA	negative
Thinking of jailbreaking my ipod touch second gen. The 4.0 update doesn't do shit for it; so i might just do it.	negative
Mom gives her 8 year old Botox injections...?!?! http://www.url.com	negative
HER PUSSY SO WET ITS LIKE THEY PUSH HER OFF THE BOAT- gucci mane omg pick another career #lmaolyrics	negative
went down to #smithfield to check out the horse market today. Shocked to hear later about shooting!!	negative
Why is microsoft word trying to correct "What do they want" to "What they want"?	negative
Geeeeze... my new post should be up tonight. 2 frickin' weeks late!	negative
has gone in to hiding until people forget Tottenhams; erm hiding.	negative
tomorrow history KA &gt;.&lt;	negative
how sprint gone be on tmobile head;;; but they never have service??? lol	negative
yeAH no yeah maybe samsung coach is a lesbian; she grabbed her but..a lot	negative
Damn you; Macaroon man.	negative
Gregory Issac R.I.P	negative
“@ArsenaLos: @user considering he gets absolutely no service from the mids and receives even less crosses...can't disagree?;	negative
aint no love n the heart of the city!	negative
Each time MicroSoft comes out with a new version of Internet Explorer; we are hit with a rash of incompatibilities in our discussion spaces.	negative
Well; I also need a computer that doesn't faint by mere mentioning of Maya and mudbox. And suddenly my money would be gone. :(	negative
there is a screech owl outside my window cant sleep :(	negative
Why do you look like a Hampster with Guile from Street Fighters hair; Tell me why why!? @user	negative
somebody please tell him who the f i is	negative
Why they playing all these sad songs	negative
At home depot ppl askin for flashlights batteries etc; front door signs say SOLD OUT of ALL storm supplies haha #idiots are too late	negative
Am throwing my ass out there	negative
They aint fucking wit me new orleans NO!! old school bitch I let her blow me like nintendo * meek mill voice	negative
I don't know how my tv ended up on TLC but upon waking from my nap; I've seen "650lb Virgin" and "2 Ton Man." Womp womp.	negative
"WHO CALLED THE BOSS!"	negative
This explains the inane junk mails I constantly receive . . . Microsoft Rips Google With Gmail Man [VIDEO] http://www.url.com 	negative
Sad day for hockey: Plane carrying KHL team crashes http://www.url.com 	negative
Man that gucci mane shit has some really hot beats but he just trashes them... Not in a good way..	negative
Santa asked me today what I wanted for Christmas; I said Windows 7; and he said no.	negative
I hate waking up at 7:45 in the morning for work :( TRYING this out http://www.url.com 	negative
Does everything have to be a freaking competition between us?  Gosh!	negative
One of my lil sis screws came up missing in day care	negative
Wondering if my gucci shoes survived this horrible weather again!	negative
Cleveland sports: one giant #wtf ????? #relaxdontworryhaveahomebrew	negative
You've really sunk to a new low if you're a Bing Googler.	negative
Mr poles lecture on the life cycle of stars and the galaxy; I have never been so confused in my entire life!	negative
There goes Skype down the drain.........Report: Microsoft near $7 billion deal for Skype http://www.url.com  via @user	negative
How are the Nike shorts even remotely attractive?? I know you'll appreciate this thought @user #saveitforthegym #maybe	negative
!!!!!! RT @user RT @user I swear... Lamar Odom's head looks like Microsoft Word 2000	negative
wishing i was chelsea	negative
Nervous for my interview for grad school! :-/	negative
I'm dying at these Nike Mag prices; although my size (7) is the cheapest; do I have a spare 5000+ bucks lying around? http://www.url.com 	negative
You know Microsoft dude they don't like to loose cash @user	negative
Hard times my friends! My nintendo wii has officially been sold!@quigonjinn hope ur happy!	negative
Does anyone at Sony not have a lisp; and accent; or lungs the size of a walnut?	negative
Dropping your iPod on your toe; and slamming your head into a door and dresser is not a good way to start your day..	negative
What's gucci with all you hardcore kids? Follow us; mention us; kill ryan	negative
what happened at #IsraeliEmbassy was wrong ! .. even if I participated in it I must say what I did was wrong .. #Randomthoughts	negative
Ugh... I'm tired of adidas it dnt make no damn sense...	negative
The news is making this sad cat-murder story as serious as they would a serial killer...because after killing cats "people are next"	negative
Fuck me; Merthyr Tydfil Travelodge is no Reading Hilton that's for sure.	negative
Not impressed with a soggy Tesco's sandwich.	negative
Lol awwhhh :( RT @user I juss cried like forreal lol RT @user Exactly 2 weeks left. *tear*	negative
Wish Twitter had Live Chat.. Zzzzzz	negative
Want Nintendo to sell Super Mario Galaxy 2 soundtrack over here in the states. I'm not importing for $40.	negative
Day 15 and we know maybe 2% of the show	negative
